{
  "name": "dezkareid-ai-team",
  "owner": {
    "name": "Joel Humberto Gomez Paredes",
    "email": "elmaildeldezkareid@gmail.com",
    "url": "https://github.com/dezkareid"
  },
  "metadata": {
    "description": "Dezkareid AI Tooling",
    "version": "1.16.0"
  },
  "plugins": [
    {
      "name": "npm-tools",
      "version": "0.0.1",
      "description": "Tools for working with npm",
      "source": "./plugins/npm-tools"
    },
    {
      "name": "design-system",
      "version": "0.0.2",
      "description": "Authoritative design system context and tools",
      "source": "./plugins/design-system"
    },
    {
      "name": "company-context",
      "version": "0.2.0",
      "description": "Authoritative company context and tools",
      "source": "./plugins/company-context"
    },
    {
      "name": "web-quality",
      "version": "0.0.1",
      "description": "Skills for auditing and optimizing web quality (Performance, Accessibility, SEO, Core Web Vitals, Best Practices)",
      "source": "./plugins/web-quality"
    },
    {
      "name": "frontend-tools",
      "version": "0.1.1",
      "description": "Expert procedural guidance for frontend development (React, Next.js, etc.)",
      "source": "./plugins/frontend-tools"
    },
    {
      "name": "database-tools",
      "version": "0.0.1",
      "description": "Expert procedural guidance for database optimization and best practices",
      "source": "./plugins/database-tools"
    },
    {
      "name": "orca-tools",
      "version": "0.0.1",
      "description": "Orca worktree, orchestration and repository setup skills",
      "source": "./plugins/orca-tools"
    },
    {
      "name": "project-management",
      "version": "0.0.1",
      "description": "Skills for planning work with GitHub Projects, issues and epics",
      "source": "./plugins/project-management"
    }
  ]
}
